{
  "identifier": "full",
  "namespace": "org.adiwg.profile",
  "alternateId": ["full"],
  "title": "Full",
  "description": "Every supported component",
  "version": "VERSION",
  "components": {
    "record": {},
    "contact": {},
    "dictionary": {}
  },
  "nav": {
    "record": [
      {
        "title": "Main",
        "target": "record.show.edit.main",
        "tip": "Basic information about the resource."
      },
      {
        "title": "Metadata",
        "target": "record.show.edit.metadata",
        "tip": "Information about the metadata for the resource."
      },
      {
        "title": "Keywords",
        "target": "record.show.edit.keywords",
        "tip": "Terms used to describe the resource."
      },
      {
        "title": "Extent",
        "target": "record.show.edit.extent",
        "tip": "Information describing the bounds of the resource."
      },
      {
        "title": "Spatial",
        "target": "record.show.edit.spatial",
        "tip": "Information concerning the spatial attributes of the resource."
      },
      {
        "title": "Lineage",
        "target": "record.show.edit.lineage",
        "tip": "Information on the history of the resource."
      },
      {
        "title": "Data Quality",
        "target": "record.show.edit.dataquality",
        "tip": "Information about quality of the underlying resource data"
      },
      {
        "title": "Taxonomy",
        "target": "record.show.edit.taxonomy",
        "tip": "Information on the taxa associated with the resource."
      },
      {
        "title": "Distribution",
        "target": "record.show.edit.distribution",
        "tip": "Information about obtaining the resource."
      },
      {
        "title": "Constraints",
        "target": "record.show.edit.constraint",
        "tip": "Information about constraints applied to the resource."
      },
      {
        "title": "Associated",
        "target": "record.show.edit.associated",
        "tip": "Other resources with a defined relationship to the resource."
      },
      {
        "title": "Documents",
        "target": "record.show.edit.documents",
        "tip": "Other documents related to, but not defining, the resource."
      },
      {
        "title": "Funding",
        "target": "record.show.edit.funding",
        "tip": "Information about funding allocated to development of the resource."
      },
      {
        "title": "Dictionaries",
        "target": "record.show.edit.dictionary",
        "tip": "Data dictionaries associated with the resource."
      }
    ],
    "dictionary": [
      {
        "title": "Main",
        "target": "dictionary.show.edit.index",
        "tip": "Basic information about the dictionary."
      },
      {
        "title": "Citation",
        "target": "dictionary.show.edit.citation",
        "tip": "The citation for the dictionary."
      },
      {
        "title": "Domains",
        "target": "dictionary.show.edit.domain",
        "tip": "Information about defined value lists."
      },
      {
        "title": "Entities",
        "target": "dictionary.show.edit.entity",
        "tip": "Information about entities(tables) and attributes(columns or fields)."
      }
    ]
  }
}
